{
  "schemaVersion": 1,
  "project": "SHOMARA",
  "updatedAt": "2026-10-28",
  "currentPhase": "N02",
  "currentTask": "N02-07",
  "statusValues": ["TODO", "READY", "IN_PROGRESS", "BLOCKED", "DEFERRED", "DONE", "DONE_WITH_BLOCKER"],
  "canonicalDocs": [
    "AGENTS.md",
    "START_HERE.md",
    "ZCODE.md",
    "docs/README.md",
    "docs/roadmap/SHOMARA_NATIVE_ROADMAP_FA.md",
    "docs/roadmap/PHASE_CHECKLISTS_FA.md",
    "docs/architecture/REPOSITORY_MAP_FA.md",
    "docs/architecture/PACKAGE_BOUNDARIES_FA.md",
    "docs/architecture/DESIGN_SYSTEM_MIGRATION_FA.md",
    "docs/architecture/ANDROID_MODULE_GRAPH.md",
    "docs/architecture/ANDROID_BUILD_ENVIRONMENT.md",
    "docs/adr/ADR-0036-android-native-foundation.md",
    "skills/shomara-product-design/SKILL.md",
    "skills/shomara-android-build/SKILL.md",
    "skills/shomara-design-system/SKILL.md",
    "skills/shomara-screen-execution/SKILL.md",
    "skills/shomara-learning-content/SKILL.md",
    "design/MASTER.md",
    "design/INSPIRATION_GUARDRAILS.md",
    "design/playbook/PAGE_UIUX_BLUEPRINT.md",
    "design/playbook/COMPONENT_READINESS.md",
    "design/playbook/NATIVE_IMPLEMENTATION.md",
    "design/playbook/quality/NATIVE_IMPLEMENTATION_BACKLOG.csv",
    "docs/delivery/SHOMARA_FINAL_CHAT_HANDOFF.md",
    "content-library/INTEGRATION_GATE.md",
    "content-library/integration/SOURCE_AUDIT.md",
    "content-library/integration/PHASE_INTEGRATION.md",
    "content-library/integration/AUTHORING_CONTRACT_GAPS.md",
    "harness/roadmap.json",
    "harness/file-ledger.json",
    "harness/dependency-map.json",
    "harness/WORKLOG.md"
  ],
  "commandAllowlist": [
    "git status",
    "git diff",
    "git log",
    "git ls-files",
    "rg ",
    "node tools/harness.mjs",
    "node scripts/verify-",
    "npm ci",
    "npm run ",
    "npm --workspace ",
    "npx vitest run",
    "./gradlew ",
    "gradlew.bat "
  ],
  "humanGates": [
    { "id": "HG-01", "phase": "N02", "title": "تأیید applicationId نهایی Android و minimum SDK", "status": "APPROVED", "evidence": "دستور مستقیم مالک برای ادامهٔ پیاده‌سازی؛ applicationId=com.mathlearning.app و minSdk=24 در ADR-0036 ثبت شد." },
    { "id": "HG-02", "phase": "N03", "title": "بازبینی مالک روی Design System V3 و سه صفحهٔ نماینده", "status": "NOT_DUE", "evidence": "Path/Auth/Lesson screenshot روی 360 و 390dp." },
    { "id": "HG-03", "phase": "N07", "title": "تأیید حقوق، moderation و workflow انتشار صوت", "status": "NOT_DUE", "evidence": "CMS/audio release checklist." },
    { "id": "HG-04", "phase": "N08", "title": "QA آموزشی کودک و متخصص محتوا", "status": "NOT_DUE", "evidence": "جلسه و issueهای ثبت‌شده؛ بدون دادهٔ شخصی کودک." },
    { "id": "HG-05", "phase": "N10", "title": "مجوز صریح ساخت artifact نهایی و signing", "status": "NOT_DUE", "evidence": "release checklist + owner approval." }
  ],
  "phases": [
    {
      "id": "N00",
      "title": "Repository Reset & Evidence",
      "status": "DONE_WITH_BLOCKER",
      "branch": "chore/p00-repository-baseline",
      "goal": "حذف artifact تولیدی، تثبیت canonical docs و baseline قابل اثبات.",
      "allowedPaths": [".gitignore", "AGENTS.md", "README.md", "START_HERE.md", "docs/**", "scripts/verify-mobile-release.mjs", "apps/web/lib/__tests__/**", "parity-out-expo/**"],
      "gates": ["npm run build:packages", "npm run typecheck:all", "npm run test:unit", "npm run verify:static:all", "git diff --check"],
      "tasks": [
        { "id": "N00-01", "title": "ثبت clone و baseline commit", "status": "DONE", "dependsOn": [], "acceptance": ["commit و branch ثبت شده", "working tree اولیه بررسی شده"], "evidence": ["START_HERE.md §2"] },
        { "id": "N00-02", "title": "حذف parity-out-expo از Git", "status": "DONE", "dependsOn": ["N00-01"], "acceptance": ["صفر فایل tracked", "مسیر در gitignore"], "evidence": ["125 فایل و 8.35MB حذف شد"] },
        { "id": "N00-03", "title": "تثبیت AGENTS و START_HERE", "status": "DONE", "dependsOn": ["N00-01"], "acceptance": ["SHOMARA تنها محصول فعال", "AVA بسته اعلام شده"], "evidence": ["commit f43bb02"] },
        { "id": "N00-04", "title": "اصلاح scope release verifier", "status": "DONE", "dependsOn": ["N00-02"], "acceptance": ["generated parity output اسکن نمی‌شود", "release verifier PASS"], "evidence": ["scripts/verify-mobile-release.mjs"] },
        { "id": "N00-05", "title": "ایزوله‌سازی unit test OTP", "status": "DONE", "dependsOn": ["N00-01"], "acceptance": ["fetch mock شده", "هیچ شبکهٔ واقعی از unit test"], "evidence": ["503/503 Vitest PASS"] },
        { "id": "N00-06", "title": "تأیید Node 22 toolchain", "status": "DONE", "dependsOn": ["N00-04", "N00-05"], "acceptance": ["build/typecheck PASS", "503/503 tests PASS"], "evidence": ["Node 22.22.0 run"] },
        { "id": "N00-07", "title": "اجرای browser gates", "status": "DONE_WITH_BLOCKER", "dependsOn": ["N00-06"], "acceptance": ["blocker دقیق ثبت شده", "gate ضعیف نشده"], "evidence": ["Chromium download 0-byte/invalid ZIP"], "blocker": "BLOCKED_ENV: Chromium unavailable in runner" }
      ]
    },
    {
      "id": "N01",
      "title": "Clean Architecture & Repository Structure",
      "status": "DONE_WITH_BLOCKER",
      "branch": "chore/n01-clean-architecture",
      "goal": "کاهش سردرگمی و حجم، ساخت نقشهٔ مصرف‌کننده و آماده‌کردن مرزهای مهاجرت بدون شکستن کلاینت فعلی.",
      "allowedPaths": ["*.md", ".nvmrc", "package.json", "package-lock.json", "docs/**", "harness/**", "tools/**", "scripts/verify-repository-harness.mjs", "design/playbook/quality/EXECUTION_CHECKPOINT.md", "apps/mobile/**", "packages/design-system/**"],
      "gates": ["npm run harness:validate", "npm run verify:repository", "npm run build:packages", "npm run typecheck:all", "npm run test:unit", "npm run verify:static:all", "git diff --check"],
      "tasks": [
        { "id": "N01-01", "title": "حذف root artifactهای بدون مصرف", "status": "DONE", "dependsOn": ["N00-07"], "acceptance": ["چهار فایل orphan حذف شده", "تاریخچهٔ Git روش بازیابی است"], "evidence": ["file-ledger entries"] },
        { "id": "N01-02", "title": "استانداردسازی Node و package metadata", "status": "DONE", "dependsOn": ["N01-01"], "acceptance": [".nvmrc دقیق", "package و lockfile هم‌راستا"], "evidence": ["Node 22.22.0; engine >=22.18 <23"] },
        { "id": "N01-03", "title": "ایجاد harness و resume protocol", "status": "DONE", "dependsOn": ["N01-01"], "acceptance": ["validate/status/next/task", "schema و verifier", "ZCODE مستقل"], "evidence": ["harness/**", "tools/harness.mjs"] },
        { "id": "N01-04", "title": "ثبت repository map و package boundaries", "status": "DONE", "dependsOn": ["N01-03"], "acceptance": ["مسیرهای active/legacy/historical مشخص", "قواعد dependency Native ثبت شده"], "evidence": ["docs/architecture/**", "harness/file-ledger.json"] },
        { "id": "N01-05", "title": "ساخت consumer/dependency map برای V1/V2 و workspaceها", "status": "DONE", "dependsOn": ["N01-04"], "acceptance": ["importهای V1/V2 شمرده و مسیر مصرف ثبت شود", "workspace graph و deep imports مشخص شود", "هیچ فایل active به‌اشتباه zero-consumer اعلام نشود"], "evidence": ["harness/dependency-map.json: 518 source files / 1780 import edges", "22 V1 and 22 V2 external consumer files; zero deep workspace imports"] },
        { "id": "N01-06", "title": "دسته‌بندی و dedupe اسناد", "status": "DONE", "dependsOn": ["N01-05"], "acceptance": ["هر سند current یا historical برچسب دارد", "لینک شکسته صفر", "verifier-dependent docs حفظ شده"], "evidence": ["docs/README.md documentation index", "docs/roadmap/PHASE_CHECKLISTS_FA.md"] },
        { "id": "N01-07", "title": "طرح یکپارچه‌سازی Design System", "status": "DONE", "dependsOn": ["N01-05"], "acceptance": ["token source واحد انتخاب شده", "خروجی TypeScript/Kotlin تعریف شده", "V1/V2 retirement order ثبت شده"], "evidence": ["docs/architecture/DESIGN_SYSTEM_MIGRATION_FA.md", "packages/design-system/src/tokens.json retained as transitional canonical source"] },
        { "id": "N01-08", "title": "حذف batch اول dead code با zero-consumer proof", "status": "DONE", "dependsOn": ["N01-05", "N01-06"], "acceptance": ["consumer search قبل/بعد", "typecheck/tests سبز", "حذف‌ها در ledger"], "evidence": ["apps/mobile/src/path/PathBanner.tsx removed after corrected TS ESM resolution audit", "four remaining zero-inbound candidates retained because verifier/string consumers exist"] },
        { "id": "N01-09", "title": "بازنشستگی UI V1 و goldenهای قدیمی", "status": "BLOCKED", "dependsOn": ["N01-07", "N01-08"], "acceptance": ["تمام routeها بدون import V1", "معادل V3 verifier موجود", "browser gate سبز"], "evidence": [], "blocker": "Chromium و تکمیل consumer migration لازم است" },
        { "id": "N01-10", "title": "بستن N01 و ساخت package checkpoint", "status": "DONE_WITH_BLOCKER", "dependsOn": ["N01-06", "N01-07", "N01-08"], "acceptance": ["harness معتبر", "گیت‌های غیرمرورگری سبز", "ZIP کامل و checksum", "blockerها ثبت شده"], "evidence": ["Node 22 build/typecheck and 65 files / 502 tests PASS", "repository/release/dependency gates PASS", "static 76/81; five Chromium gates BLOCKED_ENV", "docs/delivery/SHOMARA_N01_CHECKPOINT.md"] }
      ]
    },
    {
      "id": "N02",
      "title": "Android Native Foundation",
      "status": "IN_PROGRESS",
      "branch": "native/n02-foundation",
      "goal": "ایجاد skeleton چندماژوله Android Native بدون مهاجرت عجولانهٔ صفحه.",